{
  "$schema": "https://json-schema.org/draft/2020-12/schema",
  "title": "Kamaen scene v1",
  "type": "object",
  "required": ["schemaVersion", "id", "title", "steps", "voxels"],
  "properties": {
    "schemaVersion": {
      "const": 1
    },
    "id": {
      "type": "string",
      "pattern": "^[a-zA-Z0-9_:.\\/-]+$",
      "minLength": 1,
      "maxLength": 150
    },
    "title": {
      "type": "string",
      "minLength": 1,
      "maxLength": 200
    },
    "subtitle": {
      "type": "string"
    },
    "source": {
      "type": "string"
    },
    "steps": {
      "type": "array",
      "minItems": 1,
      "items": {
        "type": "object",
        "required": ["title", "text"],
        "properties": {
          "title": {
            "type": "string"
          },
          "text": {
            "type": "string"
          }
        }
      }
    },
    "voxels": {
      "type": "array",
      "minItems": 1,
      "maxItems": 2000,
      "items": {
        "type": "object",
        "required": ["position", "color", "label", "detail", "step"],
        "properties": {
          "position": {
            "type": "array",
            "minItems": 3,
            "maxItems": 3,
            "items": {
              "type": "number"
            }
          },
          "size": {
            "type": "array",
            "minItems": 3,
            "maxItems": 3,
            "items": {
              "type": "number",
              "exclusiveMinimum": 0
            }
          },
          "color": {
            "type": "string",
            "pattern": "^#[0-9a-fA-F]{6}$"
          },
          "label": {
            "type": "string"
          },
          "detail": {
            "type": "string"
          },
          "step": {
            "type": "integer",
            "minimum": 0
          },
          "ref": {
            "type": "string",
            "pattern": "^[a-zA-Z0-9_:.\\/-]+$",
            "minLength": 1,
            "maxLength": 150
          }
        }
      }
    },
    "$schema": {
      "type": "string"
    }
  }
}
