{
  "schemaVersion": 1,
  "id": "rack",
  "title": "一座可维护的计算节点",
  "subtitle": "R4 · R04单板机柜",
  "source": "R4_HARDWARE_AND_CLUSTER.md",
  "steps": [
    {
      "title": "搭建框架",
      "text": "R04使用2×2×3候选外形，两个前维护托盘。框架本身不提供算力。"
    },
    {
      "title": "连接供给",
      "text": "背板分配已有供给，两路输出共享预算，不能各自复制一份上游功率。"
    },
    {
      "title": "装入B01",
      "text": "A托盘安装计算板，B托盘留空。跨柜内存不能直接相加。"
    },
    {
      "title": "检查风路与维护",
      "text": "运行前验通，持续负载后观察余热，再改善风路。网页只演示部件与步骤。"
    }
  ],
  "voxels": [
    {
      "position": [
        -0.75,
        1,
        -0.75
      ],
      "color": "#6e8278",
      "label": "R04结构立柱",
      "detail": "R4候选外形2×2×3；本图以拆解几何表达，非碰撞/合法性检测。",
      "step": 0,
      "ref": "r4:rack_shell",
      "size": [
        0.15,
        3,
        0.15
      ]
    },
    {
      "position": [
        -0.75,
        1,
        0.75
      ],
      "color": "#6e8278",
      "label": "R04结构立柱",
      "detail": "R4候选外形2×2×3；本图以拆解几何表达，非碰撞/合法性检测。",
      "step": 0,
      "ref": "r4:rack_shell",
      "size": [
        0.15,
        3,
        0.15
      ]
    },
    {
      "position": [
        0.75,
        1,
        -0.75
      ],
      "color": "#6e8278",
      "label": "R04结构立柱",
      "detail": "R4候选外形2×2×3；本图以拆解几何表达，非碰撞/合法性检测。",
      "step": 0,
      "ref": "r4:rack_shell",
      "size": [
        0.15,
        3,
        0.15
      ]
    },
    {
      "position": [
        0.75,
        1,
        0.75
      ],
      "color": "#6e8278",
      "label": "R04结构立柱",
      "detail": "R4候选外形2×2×3；本图以拆解几何表达，非碰撞/合法性检测。",
      "step": 0,
      "ref": "r4:rack_shell",
      "size": [
        0.15,
        3,
        0.15
      ]
    },
    {
      "position": [
        0,
        -0.4,
        0
      ],
      "color": "#86998d",
      "label": "机柜框架",
      "detail": "保留前维护通道和实际支撑。",
      "step": 0,
      "ref": "r4:rack_shell",
      "size": [
        1.65,
        0.18,
        1.65
      ]
    },
    {
      "position": [
        0,
        2.4,
        0
      ],
      "color": "#86998d",
      "label": "机柜框架",
      "detail": "保留前维护通道和实际支撑。",
      "step": 0,
      "ref": "r4:rack_shell",
      "size": [
        1.65,
        0.18,
        1.65
      ]
    },
    {
      "position": [
        0,
        1,
        -0.72
      ],
      "color": "#c2ab7f",
      "label": "供能背板",
      "detail": "两个受控输出共享上游额定能力；连接仍需真实线路。",
      "step": 1,
      "ref": "r4:power_backplane",
      "size": [
        1.4,
        2.4,
        0.12
      ]
    },
    {
      "position": [
        0,
        0.3,
        0
      ],
      "color": "#acb8a4",
      "label": "A托盘",
      "detail": "前维护托盘。R04单板节点只在A托盘装一块B01。",
      "step": 2,
      "ref": "r4:tray",
      "size": [
        1.4,
        0.13,
        1.4
      ]
    },
    {
      "position": [
        0,
        1.4,
        0
      ],
      "color": "#acb8a4",
      "label": "B托盘（空置）",
      "detail": "前维护托盘。R04单板节点只在A托盘装一块B01。",
      "step": 2,
      "ref": "r4:tray",
      "size": [
        1.4,
        0.13,
        1.4
      ]
    },
    {
      "position": [
        0,
        0.47,
        0
      ],
      "color": "#487f6c",
      "label": "B01计算板",
      "detail": "八个实体槽位，4096 B工作内存中预留512 B系统空间。",
      "step": 2,
      "ref": "r4:populated_board",
      "size": [
        1.15,
        0.15,
        1.1
      ]
    },
    {
      "position": [
        -0.42,
        0.61,
        -0.22
      ],
      "color": "#d8c7a5",
      "label": "已封装模块",
      "detail": "图中模块仅示意排布；查看B01文档中的具体八槽定义。",
      "step": 2,
      "ref": "r4:control_chip",
      "size": [
        0.17,
        0.13,
        0.25
      ]
    },
    {
      "position": [
        -0.13999999999999996,
        0.61,
        -0.22
      ],
      "color": "#d8c7a5",
      "label": "已封装模块",
      "detail": "图中模块仅示意排布；查看B01文档中的具体八槽定义。",
      "step": 2,
      "ref": "r4:control_chip",
      "size": [
        0.17,
        0.13,
        0.25
      ]
    },
    {
      "position": [
        0.14000000000000007,
        0.61,
        -0.22
      ],
      "color": "#d8c7a5",
      "label": "已封装模块",
      "detail": "图中模块仅示意排布；查看B01文档中的具体八槽定义。",
      "step": 2,
      "ref": "r4:control_chip",
      "size": [
        0.17,
        0.13,
        0.25
      ]
    },
    {
      "position": [
        0.4200000000000001,
        0.61,
        -0.22
      ],
      "color": "#d8c7a5",
      "label": "已封装模块",
      "detail": "图中模块仅示意排布；查看B01文档中的具体八槽定义。",
      "step": 2,
      "ref": "r4:control_chip",
      "size": [
        0.17,
        0.13,
        0.25
      ]
    },
    {
      "position": [
        0.72,
        1,
        0.2
      ],
      "color": "#a7c5bb",
      "label": "风冷模块",
      "detail": "实际风路、回流与余热独立存在；此演示不计算热平衡。",
      "step": 3,
      "ref": "r4:fan",
      "size": [
        0.13,
        0.8,
        0.8
      ]
    }
  ]
}
