{
  "schemaVersion": 1,
  "id": "impact",
  "title": "从晶坯到第一份响应",
  "subtitle": "E1 · 冲击与测量工作站",
  "source": "EARLY_E1_GAMEPLAY.md",
  "steps": [
    {
      "title": "建立支撑",
      "text": "先固定工作区。这里采用3×3示意基座，具体多方块尺寸仍待空间原型验证。"
    },
    {
      "title": "放置同批晶坯",
      "text": "保留一份参考；另一份记录朝向、质量和加工前状态。"
    },
    {
      "title": "改变一次冲击",
      "text": "只改变源档位、朝向或一处缓冲条件，比较残余结构与损伤。"
    },
    {
      "title": "复测并回到生产",
      "text": "测量工作窗，选择适合已有设备的晶体；失败残片进入有损回收。"
    }
  ],
  "voxels": [
    {
      "position": [
        -1,
        0,
        -1
      ],
      "color": "#718b80",
      "label": "支撑基座",
      "detail": "承接靶座与缓冲件。3×3轮廓仅作示意，E1未冻结尺寸。",
      "step": 0
    },
    {
      "position": [
        -1,
        0,
        0
      ],
      "color": "#718b80",
      "label": "支撑基座",
      "detail": "承接靶座与缓冲件。3×3轮廓仅作示意，E1未冻结尺寸。",
      "step": 0
    },
    {
      "position": [
        -1,
        0,
        1
      ],
      "color": "#718b80",
      "label": "支撑基座",
      "detail": "承接靶座与缓冲件。3×3轮廓仅作示意，E1未冻结尺寸。",
      "step": 0
    },
    {
      "position": [
        0,
        0,
        -1
      ],
      "color": "#718b80",
      "label": "支撑基座",
      "detail": "承接靶座与缓冲件。3×3轮廓仅作示意，E1未冻结尺寸。",
      "step": 0
    },
    {
      "position": [
        0,
        0,
        0
      ],
      "color": "#718b80",
      "label": "支撑基座",
      "detail": "承接靶座与缓冲件。3×3轮廓仅作示意，E1未冻结尺寸。",
      "step": 0
    },
    {
      "position": [
        0,
        0,
        1
      ],
      "color": "#718b80",
      "label": "支撑基座",
      "detail": "承接靶座与缓冲件。3×3轮廓仅作示意，E1未冻结尺寸。",
      "step": 0
    },
    {
      "position": [
        1,
        0,
        -1
      ],
      "color": "#718b80",
      "label": "支撑基座",
      "detail": "承接靶座与缓冲件。3×3轮廓仅作示意，E1未冻结尺寸。",
      "step": 0
    },
    {
      "position": [
        1,
        0,
        0
      ],
      "color": "#718b80",
      "label": "支撑基座",
      "detail": "承接靶座与缓冲件。3×3轮廓仅作示意，E1未冻结尺寸。",
      "step": 0
    },
    {
      "position": [
        1,
        0,
        1
      ],
      "color": "#718b80",
      "label": "支撑基座",
      "detail": "承接靶座与缓冲件。3×3轮廓仅作示意，E1未冻结尺寸。",
      "step": 0
    },
    {
      "position": [
        0,
        1,
        0
      ],
      "color": "#8ccdc2",
      "label": "待处理晶坯",
      "detail": "具有实际生长基材、质量、朝向和母批；不能只靠能量生成晶体。",
      "step": 1,
      "ref": "e1:raw_kamaen_crystal",
      "size": [
        0.65,
        1.3,
        0.65
      ]
    },
    {
      "position": [
        -1.1,
        1,
        0
      ],
      "color": "#d2b884",
      "label": "脉冲源",
      "detail": "先充入实际能量，再释放一次有限脉冲。示意不求解冲击波。",
      "step": 2,
      "size": [
        0.8,
        0.8,
        0.8
      ]
    },
    {
      "position": [
        1.1,
        1,
        0
      ],
      "color": "#91a69c",
      "label": "反射 / 缓冲件",
      "detail": "改变源、反射或缓冲位置，比较成型、残余应力与损伤。",
      "step": 2,
      "size": [
        0.35,
        1.4,
        1.4
      ]
    },
    {
      "position": [
        0,
        1,
        -1.2
      ],
      "color": "#d8c5a6",
      "label": "测量工装",
      "detail": "用同母批、同温窗复测；记录成功与失败，再决定如何回到生产。",
      "step": 3,
      "size": [
        0.6,
        0.8,
        0.5
      ]
    }
  ]
}
